headline,category,authors,date
"As GOP Pushback Mounts, Biden Says Jobless Need To Go Back To Work",POLITICS,Arthur Delaney and Tara Golshan,2021-05-10
Controversial Arizona Recounters Won't Pound On Voters' Doors After DOJ Complaint,POLITICS,Mary Papenfuss,2021-05-09
House GOP Leader Kevin McCarthy Says He Backs Ousting Liz Cheney From Role,POLITICS,"Hope Yen, AP",2021-05-09
Fauci: 'There's No Doubt' COVID-19 Deaths Have Been Undercounted In U.S.,POLITICS,Nina Golgowski,2021-05-09
Elizabeth Warren: President Biden Is ‘Meeting The Moment’,POLITICS,Kevin Robillard,2021-05-08
Maryland Governor Issues Blanket Pardon For Lynching Victims,POLITICS,Dominique Mosbergen,2021-05-08
Trump's DOJ Secretly Seized Washington Post Journalists' Phone Records: Report,POLITICS,Mary Papenfuss,2021-05-08
Justice Department Aims To Crack Down On 'Ghost Guns',POLITICS,"Michael Balsamo, AP",2021-05-07
Elizabeth Warren Doesn’t Believe The GOP Is Really Breaking Up With Big Business,POLITICS,Kevin Robillard,2021-05-07
Ted Cruz’s 2016 ‘Running Mate’ Reveals Why She’s ‘Very Disappointed’ In Him,POLITICS,Lee Moran,2021-05-07
Twitter Users Drag Josh Hawley For Hypocritical Tweet About Amazon,POLITICS,David Moye,2021-05-07
Florida Newspaper Rips GOP Gov. Ron DeSantis For Acting Like ‘Tyrannical' Trump,POLITICS,Lee Moran,2021-05-07
Alexandria Ocasio-Cortez Mocks Ted Cruz's 'Great Dinner' With Trump,POLITICS,Josephine Harvey,2021-05-06
Texas Republican Slams GOP For Hating 'A Good Hunk Of America',POLITICS,David Moye,2021-05-06
‘Daily Show’ Comedian Mimics Fox News' Faux Outrage To Hilarious Effect,POLITICS,Lee Moran,2021-05-06
"GOP Congressman Embraces Cowardice, Refuses To Address ‘Big Lie’ Of 2020 Election",POLITICS,Ryan Grenoble,2021-05-06
"FAA Proposes Fines Up To $32,750 For Unruly Passengers Amid New Zero-Tolerance Policy",POLITICS,Nick Visser,2021-05-06
Nancy Pelosi Posts Sarcastic Help-Wanted Ad To Skewer GOP Pressure On Liz Cheney,POLITICS,Ron Dicker,2021-05-05
Ted Cruz's Awkward Mar-A-Lago Photo Op With Trump Gets The Treatment On Twitter,POLITICS,Ed Mazza,2021-05-05
Biden To Support Waiving Patents For COVID-19 Vaccines,POLITICS,Daniel Marans and Sara Boboltz,2021-05-05
Trump Proves His Hold Over GOP Again As House Leaders Prepare To Purge Liz Cheney,POLITICS,S.V. Date,2021-05-05
San Francisco To Redirect $3.75 Million From Law Enforcement To Black Business,POLITICS,Sarah Ruiz-Grossman,2021-05-05
Facebook's Oversight Board Upholds Trump Ban — With A Big Catch,POLITICS,Ja'han Jones,2021-05-05
House Republicans Try To Cancel Liz Cheney For Telling Truth About Election,POLITICS,Arthur Delaney,2021-05-04
Judge Orders Justice Dept. To Release Trump Obstruction Memo,POLITICS,"Eric Tucker, AP",2021-05-04
FDA Reportedly Set To Approve Pfizer Vaccine For 12- To 15-Year-Olds,POLITICS,Nick Visser,2021-05-04
Biden Announces New Refugee Cap 1 Month After Backlash,POLITICS,Rowaida Abdelaziz,2021-05-03
Liz Cheney Slaps Down Trump's Attempt To Redefine 2020 Election As 'THE BIG LIE',POLITICS,Ryan Grenoble,2021-05-03
Bid To Censure Mitt Romney Over Trump Impeachment Votes Narrowly Fails,POLITICS,Hayley Miller,2021-05-02
"2 Dead, 1 Seriously Injured In 'Targeted' Oneida Nation Casino Shooting In Wisconsin",CRIME,Mary Papenfuss,2021-05-02
"Susan Wright, Endorsed By Donald Trump, Advances To U.S. House Runoff In Texas",POLITICS,"Paul J. Weber, AP",2021-05-02
Former Ethics Chief Slams Cruz's Warning To 'Woke' CEOs As 'Most Openly Corrupt' Ever,POLITICS,Mary Papenfuss,2021-05-02
What To Know About The Growing Debate Over COVID-19 Vaccine Patents And Equity,POLITICS,Sara Boboltz,2021-05-02
Former GOP State Lawmaker At Capitol On Jan. 6 Is Photographed Auditing Arizona Votes,POLITICS,Mary Papenfuss,2021-05-01
Kansas House Republican Arrested Over Alleged Attack On Student,POLITICS,"JOHN HANNA and ANDY TSUBASA FIELD, AP",2021-05-01
It's Been 10 Years Since Barack Obama And Seth Meyers Roasted Donald Trump,POLITICS,Lee Moran,2021-05-01
'Radicalized' GOP And 'Twisted People' On Fox News Called Out In Damning New Ad,POLITICS,Lee Moran,2021-05-01
"Trump Launches Scathing Attack On Rudy Giuliani House Raid: 'It Was, Like, So Unfair'",POLITICS,Mary Papenfuss,2021-04-30
"Deadly California Wildfire Was Ignited To Cover Up A Murder, Sheriff Says",CRIME,Mary Papenfuss,2021-04-30
Donald Trump Jr. Comes For Rep. Liz Cheney After She Fist-Bumps President Biden,POLITICS,Mary Papenfuss,2021-04-29
Biden Urges Passage Of Equality Act As Anti-Trans Youth Bills Advance In Several States,POLITICS,Alanna Vagianos,2021-04-29
Dr. Anthony Fauci Dismantles Joe Rogan's False And Selfish Vaccination Advice,POLITICS,Lee Moran,2021-04-29
"Harris, Pelosi Make History At Joe Biden’s First Congressional Speech",POLITICS,Sanjana Karanth,2021-04-29
Here Are The Key Moments From Biden’s Speech To Congress,POLITICS,Sanjana Karanth,2021-04-29
"Sean Hannity Questions If Any Science Involved In Vaccination, Rips Fauci",POLITICS,Ron Dicker,2021-04-28
'Daily Show' Dunks On Ted Cruz After Texas Senator Tries To Mock Trevor Noah,POLITICS,David Moye,2021-04-28
Conservative Columnist Nails Big Differences Between Biden's And Trump's First 100 Days,POLITICS,Lee Moran,2021-04-28
Organized Labor Puts Heat On Democratic Holdouts To Support PRO Act,POLITICS,Dave Jamieson,2021-04-28
Juror In Derek Chauvin Trial Says He 'Didn't See Any Remorse',CRIME,Hayley Miller,2021-04-28
Emails Show Oil Lobby Mobilized Democratic Governors' Opposition To Biden Energy Order,POLITICS,Chris D'Angelo,2021-04-27
GOP Gov. Larry Hogan Issues Stark Warning To Fellow Republicans,POLITICS,Lee Moran,2021-04-27
GOP Rep. Lauren Boebert Self-Owns With Conspiratorial Constitution Tweet,POLITICS,Lee Moran,2021-04-27
GOP Lawmakers Release Surprisingly Great COVID-19 Vaccine Ad,POLITICS,Igor Bobic,2021-04-27
Tucker Carlson Tells Viewers To Call Police If They See Kids Wearing Masks Outside,POLITICS,Josephine Harvey,2021-04-27
How Many False Claims Did Biden Make In His First 100 Days Compared To Trump?,POLITICS,Josephine Harvey,2021-04-27
GOP Group Is Rating Members’ Response To Trump’s Attempts To Overturn Democracy,POLITICS,S.V. Date,2021-04-26
California Gov. Gavin Newsom Recall Effort Qualifies For Ballot,POLITICS,Lydia O'Connor,2021-04-26
'Spineless Coward': Kevin McCarthy Ripped For Defending Trump's Riot Response,POLITICS,Ed Mazza,2021-04-26
Gubernatorial Candidate Caitlyn Jenner Gets Schooled On How California Operates,POLITICS,Mary Papenfuss,2021-04-25
Top House Republican Defends Trump's Response To Capitol Riot: 'He Put A Video Out',POLITICS,Hayley Miller,2021-04-25
Joe Biden Wants To Make Community College Free. Can Progressives Push Him Further?,POLITICS,Kevin Robillard,2021-04-25
"Mike Pence's COVID Rule-Busting Vail Vacation Cost Public $757,000 In Security Costs Alone",POLITICS,Mary Papenfuss,2021-04-25
"After Dodge On 'America First' Racism, Marjorie Taylor Greene To Star In America First Rally",POLITICS,Mary Papenfuss,2021-04-24
Laura Ingraham Kicks Up Fear Factor With Desperate New Attack On Joe Biden,POLITICS,Lee Moran,2021-04-24
Pretend Journalist Tucker Carlson Calls Real Journalists 'Cowards',POLITICS,Sebastian Murdock,2021-04-24
"Anthony Fauci Delivers Short, Sharp Shutdown Of GOP Senator's Vaccine Doubt Bluster",POLITICS,Lee Moran,2021-04-24
Watch Consumer Reports Trick A Tesla Into Driving Without A Driver,BUSINESS,Mary Papenfuss,2021-04-24
Ex-Trump Aide Reveals Inside Story Of His Wild Disinfectant Press Conference,POLITICS,Lee Moran,2021-04-24
GOP Rep. Lauren Boebert’s Hot Take On Fourth Of July Gets An Icy Reception,POLITICS,Lee Moran,2021-04-23
It's Been Exactly 1 Year Since The Most Insane Moment Of The Trump Presidency,POLITICS,Ed Mazza,2021-04-23
Sen. Ron Johnson Says He Sees 'No Reason' For COVID-19 Mass Vaccination,POLITICS,Tara Golshan,2021-04-23
GOP Governor Candidate Amanda Chase Says Derek Chauvin Conviction ‘Makes Me Sick',POLITICS,Lee Moran,2021-04-23
Biden Preparing To Recognize Armenian Massacres As Genocide: Reports,POLITICS,Josephine Harvey,2021-04-22
Grim List Of Deaths At Police Hands Grows After Chauvin Verdict,CRIME,"Lindsay Whitehurst and Alanna Durkin Richer, AP",2021-04-22
House Votes To Restrict President From Imposing Travel Bans,POLITICS,Nick Visser,2021-04-22
Biden Hopes Tax Credit Will Encourage Vaccine-Hesitant Americans To Get One Anyway,POLITICS,S.V. Date,2021-04-21
Republicans Resist Bipartisan Capitol Riot Commission,POLITICS,Arthur Delaney,2021-04-21
"Nancy Pelosi: 'Thank You, George Floyd, For Sacrificing Your Life'",POLITICS,Akbar Shahid Ahmed,2021-04-20
Jim Jordan Asked A Snarky Question About Masks And Twitter Users Did Not Hold Back,POLITICS,Lee Moran,2021-04-20
"As States Thwart Climate Progress, Progressives Pitch A Lifeline To Green Cities",POLITICS,Alexander C. Kaufman,2021-04-19
Florida Gov. Ron DeSantis Signs Controversial 'Public Disorder' Bill Into Law,POLITICS,Ryan Grenoble,2021-04-19
Ultrawealthy Americans Are Scrambling To Get Ahead Of Biden’s Planned Tax Hikes,POLITICS,Molly Redden,2021-04-19
A Tennessee Teen Was Killed By Police Inside His School. Here's What We Know.,CRIME,Nina Golgowski,2021-04-19
Sikh Community Calls For Gun Reforms After Devastating FedEx Shooting,POLITICS,"By CASEY SMITH and RICK CALLAHAN, AP",2021-04-18
Police: Indianapolis Shooter Legally Purchased 2 Semiautomatic Rifles Despite FBI Concerns,CRIME,Mary Papenfuss,2021-04-18
9 Shot At Child's Birthday Party As Nation Faces Onslaught Of Gun Violence [UPDATE],CRIME,Nina Golgowski,2021-04-18
Anderson Cooper Shares 'The Sad Fact' About Mass Shootings In The U.S.,POLITICS,Lee Moran,2021-04-17
'Nativist Crap': Critics Erupt In Fury Over New Conservative 'Anglo-Saxon' Caucus,POLITICS,Mary Papenfuss,2021-04-17
Kellyanne Conway Joins Campaign Of Senate Candidate In Ohio She Compares To Trump,POLITICS,Mary Papenfuss,2021-04-16
Fox Host Flames GOP Gov. Kristi Noem For Awful ‘Message To Illegal Immigrants’,POLITICS,Lee Moran,2021-04-16
Transgender Children Across The U.S. Are Fighting For Their Lives (Again),POLITICS,Alanna Vagianos,2021-04-16
Biden Appoints Erika Moritsugu As Asian American Liaison,POLITICS,Sarah Ruiz-Grossman,2021-04-15
House Panel Approves Bill To Study Slavery Reparations,POLITICS,Nick Visser,2021-04-15
Defense Medical Expert In Chauvin Trial: Car Exhaust Could Have Played A Role [UPDATED],CRIME,Sara Boboltz,2021-04-14
GOP Says Kamala Harris Is MIA On Immigration As She Announces Mexico Trip,POLITICS,Jennifer Bendery,2021-04-14
Here's What A Civilian Climate Corps Could Look Like,POLITICS,Alexander C. Kaufman,2021-04-14
IRS To Begin Sending Out Child Tax Credit Payments In July,POLITICS,Nick Visser,2021-04-14
Joe Manchin Says Voting Rights Bill Can Be Bipartisan. Republicans Aren't Interested.,POLITICS,"Arthur Delaney, Igor Bobic, and Paul Blumenthal",2021-04-14
Obamas Respond To Daunte Wright Shooting With A Plea For Police Reform,POLITICS,Ryan Grenoble,2021-04-13
Republicans Ridiculed For Gifting Trump 'Made Up' Tiny Bowl Award,POLITICS,Josephine Harvey,2021-04-13
'Crock Of S**t': Ex-Fox Host Gretchen Carlson Rips Network Over Tucker Carlson,POLITICS,Ed Mazza,2021-04-13
CNN's Jim Acosta Paints A Sad Picture Of Trump's Daily 'Grievance Groundhog Day',POLITICS,Josephine Harvey,2021-04-12
"Wake Up, GOP, Warns Liz Cheney: Trump Is Still Waging 'War On The Constitution'",POLITICS,Mary Papenfuss,2021-04-11
New York Raises Taxes On The Rich As State Shifts Leftward,POLITICS,Daniel Marans,2021-04-11
Biden Avoids Big Test As Battery Giants Reach Deal To Save Georgia Factories,POLITICS,Alexander C. Kaufman,2021-04-10
Home Inspector Accused Of Sex Act With Client's Elmo Doll,CRIME,David Moye,2021-04-09
Ralph Northam Endorses Predecessor Terry McAuliffe For Virginia Governor,POLITICS,"SARAH RANKIN, AP",2021-04-08
"Republicans Reveal Exactly What Marjorie Taylor Greene Stands For, Using Her Own Words",POLITICS,Lee Moran,2021-04-08
Tucker Carlson: Transgender People Threaten 'Perpetuation Of The Species',POLITICS,Ron Dicker,2021-04-08
Ex-Track And Field Coach Allegedly Tricks Students Into Sending Nude Photos,CRIME,"Alanna Durkin R, AP",2021-04-07
"Virginia Lt. Gov. Justin Fairfax Compares Himself To George Floyd, Emmett Till",POLITICS,Daniel Marans,2021-04-07
Jen Psaki Destroys Fox News 'Gotcha' Question About Georgia Voting Law,POLITICS,David Moye,2021-04-06
Ex-Trump Lawyer’s Claim About Not Worshipping Him Goes Up In Holy Smoke,POLITICS,Lee Moran,2021-04-06
Deadpan Jen Psaki Mows Down Newsmax Reporter Over 'Secret Memo' Question,POLITICS,Mary Papenfuss,2021-04-06
"GOP Has Lost Credibility On Federal Debt Gripes, Chris Wallace Tells Sen. Roy Blunt",POLITICS,Mary Papenfuss,2021-04-05
Joe Manchin Demands Changes To Joe Biden's Infrastructure Plan,POLITICS,Igor Bobic,2021-04-05
Trump Administration Mistakenly Sanctioned Italian Pizzeria Owner,POLITICS,Mary Papenfuss,2021-04-05
John Lewis’s Final Fight For Voting Rights,POLITICS,Paul Blumenthal,2021-04-04
Ilhan Omar Says Derek Chauvin Trial Has ‘Unearthed So Much Trauma’ For Minneapolis,CRIME,Sanjana Karanth,2021-04-04
Republicans Sneer At U.S. Capitol Security Fence In Scathing Supercut,POLITICS,Lee Moran,2021-04-03
"Mitt Romney Wins 'Profile In Courage' Award, For Defying A Party Of Cowards",POLITICS,Jonathan Cohn,2021-04-03
Iowa GOP Gov. Kim Reynolds Signs Bill Easing Background Checks On Guns,POLITICS,"DAVID PITT, AP",2021-04-03
"For Republicans, 2021 Is The Year To Target Trans Kids",POLITICS,Nick Visser,2021-04-03
Sean Spicer Accidentally On Mute Could Be The Weirdest Interview Of 2021,POLITICS,Lee Moran,2021-04-02
GOP Rep. Lauren Boebert Tweeted About April Fools' Day But The Joke Was On Her,POLITICS,Lee Moran,2021-04-02
Laura Ingraham Calls Warnings Of COVID-19 Surge A 'Disinformation Campaign',POLITICS,Ron Dicker,2021-04-01
Jim Clyburn 'Insulted' By Joe Manchin’s Position On Voting Rights Bill,POLITICS,Paul Blumenthal,2021-04-01
Newsmax Anchor Greg Kelly's Weird Weed Anecdote Gets Burned On Twitter,POLITICS,Ron Dicker,2021-04-01
Marjorie Taylor Greene Slammed For Claim That Working Out Is Her ‘Covid Protection’,POLITICS,Elyse Wanshel,2021-04-01
The Government Is Now Paying For Unemployed Americans' Health Insurance,POLITICS,Tara Golshan,2021-04-01
Madison Cawthorn Destroyed On Twitter For Celebrating Funding From Relief Bill He Opposed,POLITICS,Josephine Harvey,2021-03-31
House Democrats Tap Rep. Jamie Raskin To Craft Organizing Efforts,POLITICS,Kevin Robillard,2021-03-31
Joe Scarborough Slams Fox News By Airing ‘Deeply Offensive’ Clip,POLITICS,Lee Moran,2021-03-31
Ronny Chieng’s 2016 Takedown Of Fox News' Anti-Asian Bit Goes Viral Again,POLITICS,Lee Moran,2021-03-31
Fox News Lets Ex-Trump Aide Spew Fauci Conspiracy Theory With Zero Pushback,POLITICS,Lee Moran,2021-03-31
"Democrats Prepare To Push Biden For A $10 Trillion, Decade-Long Green Infrastructure Plan",POLITICS,Alexander C. Kaufman,2021-03-28
"Derek Chauvin Trial: What To Know About The Charges, Jurors And More",CRIME,Hayley Miller,2021-03-28
Jen Psaki Has It Out With Fox News Reporter Peter Doocy Over Biden Snub,POLITICS,Mary Papenfuss,2021-03-27
MSNBC's Tiffany Cross Comes For 'Princess' Meghan McCain Over Identity Politics,POLITICS,Mary Papenfuss,2021-03-27
Joe Biden Says He 'Can't Picture' U.S. Troops Being In Afghanistan In 2022,POLITICS,Akbar Shahid Ahmed,2021-03-25
Democrats Launch Senate Battle For Expanded Voting Rights,POLITICS,"Mary Clare Jalonick, AP",2021-03-25
Ex-Trump Vaccine Chief Fired From Pharma Board Over Sexual Harassment Claims,POLITICS,Nina Golgowski,2021-03-24
Virginia Becomes First Southern State To Abolish The Death Penalty,POLITICS,Jessica Schulberg,2021-03-24
High Court Weighs When Police Can Enter Homes Without Warrants,POLITICS,"Jessica Gresko, AP",2021-03-24
"Fencing Around U.S. Capitol To Be Scaled Back, Officials Say No 'Known, Credible Threat'",POLITICS,Nick Visser,2021-03-16
Senator Calls Out Opposition To Deb Haaland: 'A Woman Of Color Is Being Held To A Different Standard',POLITICS,Chris D'Angelo,2021-03-15
"No Evidence AstraZeneca Vaccine Causes Increased Blood Clot Risk, Company Says",POLITICS,Nick Visser,2021-03-15
Fauci Has 1-Word Response To Question About 'What Changed' Around Jan. 20,POLITICS,Lee Moran,2021-03-13
National Park Service Shoots Down South Dakota Request For Mount Rushmore Fireworks,POLITICS,Mary Papenfuss,2021-03-13
New York Assembly Launches Impeachment Probe Into Andrew Cuomo,POLITICS,Lydia O'Connor,2021-03-12
House Approves Pro-Union Bill Despite Dim Senate Odds,POLITICS,"BRIAN SLODYSKO, AP",2021-03-10
House Democrats End Blacklist Against Vendors That Work With Primary Challengers,POLITICS,Daniel Marans,2021-03-10
New York Senate's Top Democrat Calls For Cuomo To Resign,POLITICS,Nina Golgowski,2021-03-07
"On Bloody Sunday Anniversary, Biden Signs Executive Order To Promote Voting Rights",POLITICS,Kevin Robillard,2021-03-07
Senate Works Through Night On Path To Pass Historic COVID-19 Aid,POLITICS,"Alan Fram, Associated Press",2021-03-06
Capitol Police Request That National Guard Extend Stay In Washington By 60 Days,POLITICS,Sanjana Karanth,2021-03-05
John Kerry Laments ‘4 Terribly Lost Years’ Of Climate Change Setbacks Under Trump,POLITICS,Jeremy Blum,2021-03-04
Basketball Officials Probing Complaint That Jeremy Lin Was Called 'Coronavirus' On Court,SPORTS,Mary Papenfuss,2021-02-27
How The U.S. Is Killing Off The Death Penalty,POLITICS,Melissa Jeltsen,2021-02-26
Former Georgia Sen. Perdue Will Not Challenge Raphael Warnock In 2022,POLITICS,Sara Boboltz,2021-02-23
Neera Tanden's Confirmation To OMB Hanging By A Thread,POLITICS,Igor Bobic,2021-02-22
United Airlines Investigating Source Of Leaks On Ted Cruz's Cancun Flights,POLITICS,Mary Papenfuss,2021-02-21
"Steve Scalise, No. 2 House Republican, Still Won't Say Election Wasn't Stolen",POLITICS,Hayley Miller,2021-02-21
Merrick Garland Vows To Oversee Prosecution Of Capitol Rioters As Attorney General,POLITICS,Nina Golgowski,2021-02-21
Florida Is A Model For Voting. The GOP Wants Change Anyway.,POLITICS,"NICHOLAS RICCARDI and BOBBY CAINA CALVAN, AP",2021-02-20
Naomi Osaka Beats Jennifer Brady To Win Second Australian Open,SPORTS,"Ian Ransom, REUTERS",2021-02-20
"Air Force Orders New Review Into Racial, Ethnic Disparities",POLITICS,"Lolita C. Baldor, AP",2021-02-20
Biden Says 'Substance Of Charge' Against Trump Was 'Not In Dispute',POLITICS,Mary Papenfuss,2021-02-14
Members Of Congress Recount Capitol Attack,POLITICS,HuffPost Editors,2021-02-05
Pentagon Chief Lloyd Austin Purges Defense Advisory Boards; Trump Loyalists Out,POLITICS,"LOLITA C. BALDOR, AP",2021-02-03
"Biden, Yellen Say GOP COVID-19 Aid Too Small, Democrats Push On",POLITICS,"Lisa Mascaro and Josh Boak, AP",2021-02-03
Joe Biden Launches Effort To Repair Trump's Immigration Damage,POLITICS,Rowaida Abdelaziz and Elise Foley,2021-02-02
"For Marjorie Taylor Greene, ‘Politics Trumps Truth,’ Mother Of Parkland Victim Says",POLITICS,Nick Visser,2021-02-01
Biden Threatens Sanctions On Myanmar After Military Coup,POLITICS,"Matthew Lee, AP",2021-02-01
Biden Invites 10 GOP Senators To White House To Discuss Smaller COVID-19 Relief Proposal,POLITICS,Nick Visser,2021-02-01
GOP Senator Calls For 'Strong Response' To Marjorie Taylor Greene Rhetoric,POLITICS,Josephine Harvey,2021-01-31
10 GOP Senators Float Much Smaller COVID-19 Relief Proposal As Dems Prepare To Go It Alone,POLITICS,Hayley Miller,2021-01-31
Deal Or No Deal: COVID-19 Aid Tests Biden 'Work Together' Plea,POLITICS,"Jonathan Lemire and Lisa Mascaro, AP",2021-01-31
GameStop Soars Again; Wall Street Bends Under The Pressure,BUSINESS,"Stan Choe, Damian J. Troise, and Alex Veiga, AP",2021-01-30
U.S. 'Anti-Science' Movement Sacrificed 'Tens Of Thousands' Of Lives To COVID: Medical Expert,POLITICS,Mary Papenfuss,2021-01-30
Public Health Expert Names What Trump Admin May Have Gotten 'Most Wrong' About Pandemic,POLITICS,Lee Moran,2021-01-30
Shirley Weber Sworn In As California's First Black Elections Chief,POLITICS,Sarah Ruiz-Grossman,2021-01-30
"Biden Gets Positive Marks For First Steps As President, Survey Finds",POLITICS,Ariel Edwards-Levy,2021-01-29
Washington Post Editorial Rips Republicans 'Crawling Back' To Donald Trump,POLITICS,Lee Moran,2021-01-29
Sacramento Officials Under Fire After Homeless People Died During Storms,POLITICS,Sarah Ruiz-Grossman,2021-01-28
"Man Arrested Near Capitol With Gun Had 'Stop The Steal' Paperwork, List Of Politicians",POLITICS,Sebastian Murdock,2021-01-28
Nancy Pelosi: Lawmakers Need Protection From Each Other Because 'The Enemy Is Within',POLITICS,Jennifer Bendery,2021-01-28
Biden Moves Quickly To Repair White House Relationship With Federal Workforce,POLITICS,Dave Jamieson,2021-01-28
Oregon GOP Embraces Capitol Riot 'False Flag' Conspiracy Theory,POLITICS,Lee Moran,2021-01-27
Democrats Reintroduce Legislation To 'Decriminalize Immigration',POLITICS,Sarah Ruiz-Grossman,2021-01-26
Joe Biden Says Trump's Impeachment Trial In Senate 'Has To Happen',POLITICS,Sarah Ruiz-Grossman,2021-01-26
Biden Administration Says It Will Buy 200 Million More COVID-19 Shots,POLITICS,Jonathan Cohn,2021-01-26
DOJ Rescinds ‘Zero Tolerance’ Immigration Rule Used For Family Separation,POLITICS,"Michael Balsamo and Colleen Long, AP",2021-01-26
Joe Biden Repeals Donald Trump’s Transgender Military Ban,POLITICS,Alanna Vagianos,2021-01-25
Budweiser Won't Air Super Bowl Ads For First Time In 37 Years,POLITICS,"MAE ANDERSON and DEE-ANN DURBIN, AP",2021-01-25
"Live By The Sharpie, Die By The Ballpoint ― Much Of Trump’s Legacy Undone In Days",POLITICS,S.V. Date,2021-01-25
"Lawmakers Face Threat Of Second Capitol Attack Ahead Of Impeachment, AP Reports",POLITICS,"Michael Balsamo, AP",2021-01-25
Trump Peddled Misleading COVID-19 Charts To The Public: Dr. Birx,POLITICS,Mary Papenfuss,2021-01-25
Tom Brady And Tampa Bay Buccaneers Beat Green Bay Packers To Win NFC Title,SPORTS,"Frank Schwab, Yahoo Sports",2021-01-24
"Capitol Violence Sparks Discussion Of Secret, Safer Impeachment Trial Vote",POLITICS,Mary Papenfuss,2021-01-24
"Mitt Romney: Trump Impeachment Trial Important For 'Unity,' 'Accountability'",POLITICS,Hayley Miller,2021-01-24
"In First Days, Biden Flashes Action As Deep Problems Await",POLITICS,"Jonathan Lemire, AP",2021-01-23
Democrats Start Reining In Big Expectations For Immigration Bill,POLITICS,"Alan Fram, AP",2021-01-23
Owners Discuss Removing Trump's Name From Manhattan Highrise: Report,POLITICS,Mary Papenfuss,2021-01-23
Catholic Bishops Are Already Divided On How To Deal With Biden's Progressive Faith,POLITICS,Carol Kuruvilla,2021-01-22
"What A Fight Over $2,000 Checks Says About The Left's Approach To Biden",POLITICS,Daniel Marans,2021-01-22
Senate Confirms Lloyd Austin To Be The First Black Defense Secretary,POLITICS,Akbar Shahid Ahmed,2021-01-22
Tribes Lobby Republicans To Confirm Deb Haaland As Interior Secretary,POLITICS,Jennifer Bendery,2021-01-22
Uniformed Man Knelt By Beau Biden's Grave During Inaugural Address,POLITICS,Curtis M. Wong,2021-01-21
Biden Revokes Trump's 1776 Report That Downplayed Slavery,POLITICS,"Collin Binkley, AP",2021-01-21
"New White House Press Secretary, Jen Psaki, A Hit On Twitter After First Briefing",POLITICS,Josephine Harvey,2021-01-21
"Republicans Celebrate Democracy After Lying About Fraud, Voting To Overturn Election",POLITICS,Jennifer Bendery,2021-01-21
World's Saddest Trump Rally Draws Lone Protester: 'Kind Of By Myself Out Here',POLITICS,Ed Mazza,2021-01-21
Joe Biden Swore His Oath Of Office On A Giant Family Bible,POLITICS,Carol Kuruvilla,2021-01-20
Joe Biden Sworn In As 46th President Of The United States,POLITICS,Hayley Miller,2021-01-20
Biden Launches Effort To Undo Trump's Damage On Immigration,POLITICS,Rowaida Abdelaziz,2021-01-20
Joe Biden Mandates Masks On Federal Property,POLITICS,Ryan Grenoble,2021-01-20
Biden Tearfully Honors Late Son Beau: ‘We Should Be Introducing Him As President’,POLITICS,Elyse Wanshel,2021-01-19
Nurse Sings 'Amazing Grace' In Powerful Biden-Harris COVID-19 Memorial,POLITICS,Sarah Ruiz-Grossman,2021-01-19
"Sunny Hostin Slams Trump Allies For 'Enabling A Racist President,' Then Quoting MLK",POLITICS,Josephine Harvey,2021-01-19
2 National Guard Members Removed From Biden Inauguration Over Militia Ties,POLITICS,"James LaPorta and Michael Balsamo, AP",2021-01-19
White House Sculpture Garden To Feature Songwriter Who Hated Trump's Dad,POLITICS,David Moye,2021-01-18
"Woman Who Stole Pelosi's Laptop May Have Tried To Sell It To Russians, FBI Says",POLITICS,"Jan Wolfe, Reuters",2021-01-18
Trump's 'History Of Violence' Exposed In Conservative Website's Damning Supercut,POLITICS,Ed Mazza,2021-01-18
Kamala Harris Stuns Husband On CBS With Hilarious Detail About Their First Date,POLITICS,Josephine Harvey,2021-01-18
Former Trump Official Mocked For Claiming That The President Has No Platform Now,POLITICS,Josephine Harvey,2021-01-17
'My Pillow Guy' Still Hoping Trump Could Mobilize The Military To Stay In Power,POLITICS,Mary Papenfuss,2021-01-17
"Trump's Legacy: 2 Impeachments, An Insurrection, Countless Lies And Corruption",POLITICS,S.V. Date,2021-01-17
Senate Intelligence Committee Member Says Trump Should Be Cut Off From Briefings,POLITICS,Hayley Miller,2021-01-17
Biden To Unveil Plan To Offer Legal Status For Millions Of Immigrants,POLITICS,"Elliot Spagat, AP",2021-01-17
Where Does The American Far Right Go From Here?,POLITICS,Nick Robins-Early,2021-01-16
Evangelist Compares Republicans Who Voted For Trump's Impeachment To Judas,POLITICS,Carol Kuruvilla,2021-01-16
Capitol Insurrectionists Said They Were Following Trump’s Orders,POLITICS,Paul Blumenthal,2021-01-16
Mary Trump: My Uncle ‘Enjoyed Every Second’ Of Capitol Riot,POLITICS,Lee Moran,2021-01-16
Trump Administration Ends Its Execution Spree By Killing Dustin Higgs,POLITICS,Melissa Jeltsen and Jessica Schulberg,2021-01-16
