headline,category,authors,date
NY Gun Applicants Will Soon Have Social Media Accounts Screened,POLITICS,"Marina Villenueve and Maysoon Khan, AP",2022-07-08
Tucker Carlson Points Finger At Women And Weed For Latest Mass Shooting,POLITICS,Ben Blanchet,2022-07-06
Patrick Lyoya’s Death Casts A Light On How Police Mishandle Traffic Stops,POLITICS,Phillip Jackson,2022-07-05
Rep. Lauren Boebert's Terrible Take On Denmark Shooting Slammed As 'Deadly' Stupid,POLITICS,Josephine Harvey,2022-07-05
"There's 'Ample Probable Cause To Charge Trump,' Says Ex-Cop Wounded In Insurrection",POLITICS,Mary Papenfuss,2022-07-03
"Girl, 10, Reportedly Forced To Travel Out Of State For Abortion",POLITICS,Mary Papenfuss,2022-07-03
"Supreme Court Shakes Nation To Core, Has No Plans To Ease Up",POLITICS,"By Mark Sherman, AP",2022-07-02
Florida Pediatrician Axed From State Board For Pro-Vaccine Comments,POLITICS,Sara Boboltz,2022-07-02
"'Tiger King' Star Charged With Animal Trafficking, Money Laundering",CRIME,Ben Blanchet,2022-07-01
Supreme Court Rules Biden Properly Ended Trump's 'Remain In Mexico' Policy,POLITICS,"Jessica Gresko, AP",2022-06-30
Ex-Aide Releases Melania Trump's Revealing 1-Word Text Message From Jan. 6,POLITICS,Ed Mazza,2022-06-29
The GOP’s Anti-LGBTQ Hysteria Is Spreading To Family Drag Shows,POLITICS,Nathalie Baptiste,2022-06-28
'Truth Hurts': Arizona's Republican AG Tells Hecklers To 'Shut The Hell Up',POLITICS,Josephine Harvey,2022-06-27
Canada Will Allow Americans To Cross The Border For Abortions: Trudeau,POLITICS,"ROB GILLIES, AP",2022-06-25
Truck Driver Rams Into Abortion Rights Demonstrators At Roe Rally In Iowa,POLITICS,Andy Campbell and Alanna Vagianos,2022-06-25
Roe v. Wade: Supreme Court Overturns Landmark Ruling Protecting Abortion Rights,POLITICS,"Elise Foley, Sara Boboltz, and Paul Blumenthal",2022-06-24
"After Bashing 'Woke' Americans, Steve Bannon Hails A Trump-Backing 'Army Of The Awakened'",POLITICS,Mary Papenfuss,2022-06-24
"Clarence Thomas: Supreme Court Could Now Restrict Marriage Equality, Contraception",POLITICS,Marita Vlachou and Amanda Terkel,2022-06-24
Republicans Are Making It Clear They Want To Ban Abortion Nationwide,POLITICS,Kevin Robillard,2022-06-24
Rep. Marjorie Taylor Greene Tells Reporter To ‘Go Back To Your Country’,POLITICS,Josephine Harvey,2022-06-23
"Steve Bannon Blasts Murdoch, Saying His Media Empire Is Dumping Trump For DeSantis",POLITICS,Mary Papenfuss,2022-06-23
Herschel Walker Says There Are 52 States,POLITICS,Amanda Terkel,2022-06-22
Woman Allegedly Being Held Hostage Gets Rescued Thanks To Grubhub Note,CRIME,David Moye,2022-06-22
NFL Seeks Arbitration For Flores' Racial Discrimination Suit,SPORTS,"LARRY NEUMEISTER, AP",2022-06-22
7 Major Takeaways From The Jan. 6 Committee's Fourth Hearing,POLITICS,Sara Boboltz and Lydia O'Connor,2022-06-21
Ginni Thomas-Linked Group Spread Election Lies At Event 2 Months After Jan. 6 Riot,POLITICS,Marita Vlachou,2022-06-21
Trump Continues Push To Shut Down Voting Methods 69% of Americans Use,POLITICS,Mary Papenfuss,2022-06-20
Ex-Watergate Prosecutor Says Georgia Probe Is The One That Could 'Send Trump To Jail',POLITICS,Josephine Harvey,2022-06-20
An Elite Christian College Has Become The Latest Battleground In America’s Culture Wars,POLITICS,Jonathan Cohn,2022-06-19
Rants By Herschel Walker's Son On Absent Fathers Go Viral At Awkward Moment,POLITICS,Mary Papenfuss,2022-06-18
Rep. Eric Swalwell Would Love To Give Trump Equal Time On Jan. 6 Probe — Under Oath,POLITICS,Mary Papenfuss,2022-06-18
The Far-Right’s Assault On An Idaho Pride Event Was Meticulously Planned,POLITICS,Christopher Mathias,2022-06-18
Twitter Users Mock Peter Navarro's Desire To Postpone Trial Because Of Book Tour,POLITICS,David Moye,2022-06-17
"Herschel Walker, After Disparaging Absent Dads, Now Says He Has 4 Kids",POLITICS,Nina Golgowski,2022-06-16
Obama Marks DACA’s 10th Anniversary In Conversation With Dreamers,POLITICS,Marina Fang,2022-06-15
"After Defying Trump, GOP Rep. Tom Rice Loses Reelection In South Carolina",POLITICS,Jonathan Nicholson,2022-06-15
Mehmet Oz Misspells Pennsylvania Address On Candidacy Form And Twitter Has Jokes,POLITICS,Ron Dicker,2022-06-14
The Races Where Democrats Are Rooting For Election Deniers,POLITICS,Kevin Robillard,2022-06-13
Mick Mulvaney Trashes Trump Staffers As 'Garbage' And Twitter Users Pounce,POLITICS,David Moye,2022-06-13
31 Patriot Front Extremists Aiming To 'Riot' At Idaho Pride Event Arrested: Officials,POLITICS,Mary Papenfuss,2022-06-12
Trump Reportedly Misusing Presidential Seal To Boost Business At 4th Golf Course,POLITICS,Mary Papenfuss,2022-06-12
"Ivanka Trump Backed Her Dad Even As She Knew He Lied, Ex-White House Aide Points Out",POLITICS,Mary Papenfuss,2022-06-11
"Trump Trapped By 'Ego' In 2020; GOP Should Leave Him There, Slams New York Post",POLITICS,Mary Papenfuss,2022-06-11
Kevin McCarthy Blames 'Everybody In The Country' For Jan. 6 Attack,POLITICS,Josephine Harvey,2022-06-10
Jared Kushner Dismissed White House Counsel's Threats To Resign As 'Whining',POLITICS,Amanda Terkel,2022-06-10
Phil Mickelson Grilled On If He Cares About Being Seen As A 'Saudi Stooge',SPORTS,David Moye,2022-06-08
Peter Navarro Ripped For Complaining That Being Arrested Wasn't Very Pleasant,POLITICS,Josephine Harvey,2022-06-07
Outraged Matthew McConaughey Begs For Commonsense Gun Laws At White House,POLITICS,Lydia O'Connor,2022-06-07
Pete Buttigieg Calls 'Door' Solution To Mass Shootings 'Definition Of Insanity',POLITICS,Mary Papenfuss,2022-06-06
"South African Pastor Found Guilty Of Treason, Racist Plot",CRIME,"MOGOMOTSI MAGOME, AP",2022-06-06
Sen. Chris Murphy: 'We're Closer Than Ever Before' On Bipartisan Gun Legislation,POLITICS,Nina Golgowski,2022-06-05
Filmmaker John Waters Complains Trump Forever Ruined Bad Taste,POLITICS,Mary Papenfuss,2022-06-05
Why Biden Is Giving Gun Control Negotiators ‘Some Space’,POLITICS,Kevin Robillard,2022-06-05
Man Robbed Of Assault Rifle At Gunpoint Opens Fire With Second Gun,CRIME,Mary Papenfuss,2022-06-03
New York Poised To Raise Age For Semiautomatic Rifles,POLITICS,"MARINA VILLENEUVE, AP",2022-06-02
Comedian Stunned After Asking Man In Confederate Flag Shirt If He’s Pro-Slavery,POLITICS,Elyse Wanshel,2022-06-02
"WATCH LIVE — A New Labor Movement: How Workers Are Unionizing Amazon, Starbucks, REI And Apple",POLITICS,Amanda Terkel,2022-06-01
"Angel Statue Beheaded At Church, $2 Million Relic Stolen",CRIME,"Michael R. Sisak, AP",2022-05-30
"Georgia DA Could Bury Trump With His Own Words, Says Former Fed Prosecutor",POLITICS,Mary Papenfuss,2022-05-30
"Weapons That Can Cause 'Grave Damage' Aren't Sacred, Texas Bishop Fumes",CRIME,Mary Papenfuss,2022-05-29
"Adam Kinzinger Calls Gun Age Limits 'A No-Brainer,' Considers Assault Weapon Ban",POLITICS,Nina Golgowski,2022-05-29
Texas Gov. Greg Abbott Loudly Booed At Uvalde Memorial,POLITICS,Mary Papenfuss,2022-05-29
Christian Nationalism On The Rise In Some GOP Campaigns,POLITICS,"PETER SMITH and DEEPA BHARATH, AP NEWS",2022-05-29
Federal Judges Overrule Ohio Supreme Court: Mandate Voided Voting Map,POLITICS,"Andrew Welsh-Huggins, AP",2022-05-28
Guilty Plea In Plot To Firebomb California Democratic HQ,CRIME,"Don Thomspon, AP",2022-05-28
Defiant Kevin McCarthy Challenges  Subpoena Authority Of Jan. 6 Committee,POLITICS,"Farnoush Amiri and Mary Clare Jalonick, AP",2022-05-28
Watch 'Slowest Pitch On Record' To Make A Batter Miss In Major League Baseball,SPORTS,Ron Dicker,2022-05-27
Gov. Greg Abbott Stops At Fundraiser After Texas School Shooting,POLITICS,Marita Vlachou,2022-05-26
Tom Brady Takes Batting Practice. Gronk Shags The Balls. Enough Said.,SPORTS,Ron Dicker,2022-05-25
Brian Kemp Easily Wins GOP Nomination Despite Being Trump’s No. 1 Revenge Target,POLITICS,S.V. Date,2022-05-25
Texas Gov. On State's Deadliest School Shooting: 'It Could Have Been Worse',POLITICS,Nina Golgowski,2022-05-25
The Supreme Court Just Made It More Likely Innocent People Will Be Executed,POLITICS,Jessica Schulberg,2022-05-24
Kellyanne Conway Finally Admits Marriage With George Conway Is On The Rocks,POLITICS,David Moye,2022-05-24
"Starbucks Leaving Russian Market, Shutting 130 Stores",BUSINESS,"DEE-ANN DURBIN, AP",2022-05-23
Appeals Court Rules Florida Law On Social Media Unconstitutional,POLITICS,"Curt Anderson, AP",2022-05-23
Teen Kidnapped At Dallas Basketball Game Found Days Later Held In Hotel Room,CRIME,Mary Papenfuss,2022-05-22
Group That Leaked Cawthorn's Nude Video Now Out To 'Fire' Lauren Boebert,POLITICS,Mary Papenfuss,2022-05-21
Trump Heaps Praise On Hungary's Viktor Orban At Conservative Conference: Report,POLITICS,Sara Boboltz,2022-05-21
CPAC Head Hails Abortion Ban As Solution To Racist 'Replacement' Fears: Vice,POLITICS,Mary Papenfuss,2022-05-20
"Doug Mastriano, Far-Right Election Denier, Wins Pennsylvania Gubernatorial Primary",POLITICS,Christopher Mathias,2022-05-18
Donald Trump Is Back On Twitter,POLITICS,Mary Papenfuss,2022-05-17
Lawrence O’Donnell Accuses Rupert Murdoch Of Shaping Thinking Of White Supremacist Killers,POLITICS,Lee Moran,2022-05-17
Congress Will Discuss UFOs For First Time In More Than 50 Years And People Have Questions,POLITICS,Ben Blanchet,2022-05-17
Democrats Have Little Time To Avert An Election-Eve Obamacare Premium Hike,POLITICS,Jonathan Cohn,2022-05-16
"Buffalo Gunman Had Previously Threatened High School Shooting, Official Says",CRIME,"Carolyn Thompson and Michael Balsamo, AP",2022-05-15
Buffalo Suspect Embraced Racist 'Replacement' Conspiracy Pushed By Tucker Carlson,CRIME,Mary Papenfuss,2022-05-15
"1 Killed, 4 Critically Wounded In California Church Shooting, Police Say",CRIME,Nick Visser,2022-05-15
Melania Trump Rips Vogue 'Bias' For Keeping Her Off The Cover,POLITICS,Mary Papenfuss,2022-05-15
"13 Shot, 10 Dead In 'Racially Motivated Hate Crime' At Buffalo Supermarket: Sheriff",CRIME,Sebastian Murdock,2022-05-14
Rep. Elise Stefanik Attacks Mysterious 'Pedo Grifters' For Shortage Of Infant Formula,POLITICS,Mary Papenfuss,2022-05-14
Ted Cruz Mocked Republicans Who Suck Up To Trump And People's Irony Meters Exploded,POLITICS,Lee Moran,2022-05-14
GOP Rep. Madison Cawthorn Receives A Brutal Reminder After Veterans Tweet,POLITICS,Lee Moran,2022-05-13
Crypto Crash Leaves Trading Platform Coinbase Slumped,BUSINESS,"Matt Ott, AP",2022-05-12
"Charles Herbster, Accused Of Groping 8 Women, Loses Nebraska Gubernatorial Race",POLITICS,Amanda Terkel,2022-05-11
New Jersey Governor Announces Proposals To Expand Abortion Access In The State,POLITICS,Ryan Grenoble,2022-05-11
Rep. Cori Bush: Biden Should 'Absolutely' Say The Word 'Abortion' More,POLITICS,Amanda Terkel,2022-05-11
House Lawmakers Approve Resolution Allowing Their Own Staffers To Unionize,POLITICS,Dave Jamieson and Arthur Delaney,2022-05-11
"US Added 428,000 Jobs In April Despite Surging Inflation",BUSINESS,"Paul Wiseman, AP",2022-05-06
Lawyer For Roe Calls Overturning The Law 'Giant Step Backward' For Privacy Rights,POLITICS,Marita Vlachou,2022-05-05
Diego Maradona's 'Hand Of God' Jersey Sells For Record Sum,SPORTS,"JILL LAWLESS, AP",2022-05-05
Rep. Shontel Brown Wins Ohio Democratic Primary,POLITICS,Daniel Marans,2022-05-04
"J.D. Vance, Trump's Pick In Ohio, Wins GOP Senate Primary",POLITICS,Liz Skalka,2022-05-04
State Legislatures To Be ‘Main Battleground’ For Abortion Rights If Roe Is Overturned,POLITICS,Travis Waldron,2022-05-04
2022 Midterms: What To Know About Tuesday's Primaries In Ohio And Indiana,POLITICS,"Julie Carr Smyth and Tom Davies, AP",2022-05-03
Gubernatorial Races More Important Than Ever With Roe v. Wade On The Chopping Block,POLITICS,Igor Bobic,2022-05-03
Rep. Jamie Raskin Rips Supreme Court Draft Against Roe v. Wade,POLITICS,Mary Papenfuss,2022-05-03
Protests Held Outside Supreme Court Following Shocking Leaked Draft About Abortion Rights,POLITICS,Marita Vlachou,2022-05-03
Joe Biden Says Roe v. Wade Shouldn't Be Overturned After Supreme Court Abortion Leak,POLITICS,Marita Vlachou,2022-05-03
Progressive Group Tries To Diversify Democratic Staffers,POLITICS,Kevin Robillard,2022-05-02
Nebraska Gubernatorial Candidate Accused Of Groping Wants To Put Sex Ed 'Back In Homes',POLITICS,Mary Papenfuss,2022-05-02
"Pelosi Visits Kyiv, Meets With Ukraine President",POLITICS,"Vanessa Gera, Nicole Winfield and Lisa Mascaro, AP",2022-05-01
2nd Woman Publicly Accuses Nebraska Candidate Of Groping,POLITICS,Mary Papenfuss,2022-05-01
Joe Manchin Backs West Virginia Republican In Primary Against MAGA Challenger,POLITICS,Sanjana Karanth,2022-05-01
Mark Meadows Says Jan. 6 Panel Leaked Texts To 'Vilify' Him,POLITICS,"Eric Tucker, AP",2022-04-30
NFL Network Introduces Malik Willis' 'Mom' At NFL Draft — But It Wasn't His Mom,SPORTS,Ron Dicker,2022-04-29
Hope Solo Asks To Postpone Hall Of Fame Ceremony So She Can Go To Rehab,SPORTS,David Moye,2022-04-29
Marjorie Taylor Greene Spews Head-Spinning Double Talk To Laura Ingraham,POLITICS,Ron Dicker,2022-04-28
A Major ‘Alt-Right’ Figure Just Disavowed White Nationalism,POLITICS,Christopher Mathias,2022-04-28
Republicans Cheer As Congressional Candidate Demands Fauci’s Execution By Firing Squad,POLITICS,Lee Moran,2022-04-27
Ex-FBI Assistant Director Accuses Tucker Carlson Of Aiding And Abetting Terrorism,POLITICS,Lee Moran,2022-04-27
Trump's Latest Boast Gets Brutal Fact-Check From His Own Niece,POLITICS,Ed Mazza,2022-04-26
Lucius Fox Makes Sickening Exit Just 2 Pitches Into Game,SPORTS,Ron Dicker,2022-04-25
Donald Trump Says Prince Harry Is 'Whipped' In Marriage To Meghan Markle,POLITICS,Ron Dicker,2022-04-25
"Californian Charged With Making Violent, Anti-Trans Threats Against Merriam-Webster",POLITICS,Sarah Ruiz-Grossman,2022-04-23
Biden Administration Urges Global Trade Chief To Release COVID-19 Patent Waiver Text,POLITICS,Daniel Marans,2022-04-21
Biden’s Plan To Battle The Opioid Epidemic: Access To Naloxone,POLITICS,Kevin Robillard,2022-04-21
Ex-Labor Secretary Warns How Donald Trump Could Actually Steal The 2024 Election,POLITICS,Lee Moran,2022-04-20
Dashcam Video Shows Madison Cawthorn Surrendering His Driver's License,POLITICS,David Moye,2022-04-20
Jen Psaki Says Court Ruling Ending Mask Mandate For Travel Is 'Disappointing',POLITICS,Marita Vlachou,2022-04-19
Justice Department Prepares To Appeal Judge's Ruling On Transportation Mask Mandate,POLITICS,Lydia O'Connor,2022-04-19
Happy Tax Day! Even The Treasury Department Thinks The IRS Is Terrible.,POLITICS,Arthur Delaney,2022-04-18
Rain Dampens The 1st White House Easter Egg Roll Since 2019,POLITICS,"DARLENE SUPERVILLE, AP",2022-04-18
Tatum's Layup At Buzzer Gives Celtics 115-114 Win Over Nets,SPORTS,"KYLE HIGHTOWER, AP",2022-04-17
"For The Starbucks Union Campaign, A Bruising Contract Fight Is Just Beginning",BUSINESS,Dave Jamieson,2022-04-16
Arrest Made In South Carolina Mall Shooting That Wounded 14 People,CRIME,Sara Boboltz and Nina Golgowski,2022-04-16
"Man, 21, Arrested A Week After 3 Killed At Georgia Gun Range",CRIME,"Associated Press, AP",2022-04-16
"Mike Bossy, Islanders Great And 4-Time Stanley Cup Champion, Dies At 65",SPORTS,"Stephen Whyno, AP",2022-04-15
Congress Might Finally Do Something About The Exorbitant Cost Of Prison Phone Calls,POLITICS,Jessica Schulberg,2022-04-15
Elon Musk Offers To Buy 100% Of Twitter,BUSINESS,Marita Vlachou,2022-04-14
Ron DeSantis Signals Support For Woman Who Stole Fetal Remains From D.C. Clinic,POLITICS,Alanna Vagianos,2022-04-14
Ex-Trump Aide Stephen Miller Speaks To 1/6 Panel,POLITICS,"Eric Tucker and Farnoush Amiri, AP",2022-04-14
FDA Authorizes First Breathalyzer Test To Detect COVID-19,POLITICS,Sarah Ruiz-Grossman,2022-04-14
LA Political Donor Gets 30 Years In Prison For Fetish Deaths,CRIME,"BRIAN MELLEY, AP",2022-04-14
White House Says Story That Bird Pooped On Joe Biden Is Just Crap,POLITICS,David Moye,2022-04-13
Blame Trump? Jury Hears That Defense At Capitol Riot Trial,POLITICS,"Michael Kunzelman, AP",2022-04-13
How A Trump Tax Break For The Poor Led To A $30 Million Gold Stash In A Queens Warehouse,POLITICS,Molly Redden,2022-04-12
DOJ Denies Jan. 6 Panel Details In Trump Records Probe,POLITICS,"Farnoush Amiri, AP",2022-04-12
Marjorie Taylor Greene Argues U.S. Capitol Riot Happened Just 'One Time',POLITICS,Josephine Harvey,2022-04-12
"Biden Announces New Gun Control Rule, ATF Nominee",POLITICS,Kevin Robillard and S.V. Date,2022-04-11
"Trump Is Basking In Surreal, Adoring Mar-a-Lago Bubble, Says Reporter",POLITICS,Mary Papenfuss,2022-04-11
Ohio Fairgrounds Turns Down Upcoming Trump Political Rally,POLITICS,Mary Papenfuss,2022-04-09
Las Vegas Teen Accused Of Attempting To Murder His Teacher,CRIME,"Ken Ritter, AP",2022-04-09
Trump-Backed Vernon Jones Says Civil Rights Don't Apply To Gay People Because They 'Can Change',POLITICS,Mary Papenfuss,2022-04-09
Books Are The Latest Casualty Of The New Conservative Culture War,POLITICS,Nathalie Baptiste,2022-04-08
Twitter Beef Between Rep. Marjorie Taylor Greene and Jimmy Kimmel Enters Its 2nd Day,POLITICS,David Moye,2022-04-08
Gov. Greg Abbott Says Texas Will Bus Undocumented Immigrants To D.C.,POLITICS,Lydia O'Connor,2022-04-07
"Rand Paul Held Up Ketanji Brown Jackson's Senate Vote, And Twitter Was Not Having It",POLITICS,David Moye,2022-04-07
Ex-Trump Officials Urge Texas To Declare Border 'Invasion',POLITICS,"ACACIA CORONADO and PAUL J. WEBER, AP",2022-04-06
Jan. 6 Committee Obtains 101 Emails From Former Trump Lawyer,POLITICS,Nick Visser,2022-04-06
Sen. Josh Hawley Washes His Hands Of The 'Pro-Pedophile' Smears He Ignited,POLITICS,Arthur Delaney,2022-04-05
"GOP Rep. Fred Upton, Who Voted To Impeach Trump, Announces Retirement",POLITICS,Liz Skalka,2022-04-05
‘Now Or Never’: New U.N. Report Sees Narrow Path For Averting Climate Catastrophe,POLITICS,Chris D'Angelo,2022-04-04
Ukrainian Americans Protest California Church Talk By Putin Defender Tucker Carlson,POLITICS,Mary Papenfuss,2022-04-04
Sarah Palin Is Running For Congress In Alaska,POLITICS,Mary Papenfuss and Celeste Lavin,2022-04-02
Ted Cruz Imagines 'Taking Peyote' Nude During His Upcoming Yale Appearance,POLITICS,Mary Papenfuss,2022-04-02
Trump Tells Member Of Gays For Trump At Mar-a-Lago: 'You Don't Look Gay',POLITICS,Mary Papenfuss,2022-04-02
Alaska Airlines Cancels Dozens Of Flights As Pilots Picket,BUSINESS,"Gillian Flaccus, AP",2022-04-01
Marjorie Taylor Greene Sues To Stop Challenge To Her Reelection Eligibility,POLITICS,"Kate Brumback, AP",2022-04-01
DC Police Find 5 Fetuses In Home Of Anti-Abortion Activist Lauren Handy,CRIME,Sebastian Murdock,2022-03-31
Cory Booker Explains Why He Went To Bat For Ketanji Brown Jackson,POLITICS,Philip Lewis,2022-03-30
This Texas City’s Water Crisis Is Shaping A Democratic Congressional Primary,POLITICS,Daniel Marans,2022-03-29
Joe Biden Slaps Down Question From Fox News' Peter Doocy: 'You Got To Be Silly',POLITICS,Mary Papenfuss,2022-03-29
Trump Touts 'Massive' Turnout At Georgia Rally That Journalists Say Was 'Smallest' In Years,POLITICS,Mary Papenfuss,2022-03-28
Ukraine Ambassador On Putin's Strategy: ‘We Can Always Count On Russia Lying’,POLITICS,Sanjana Karanth,2022-03-27
Biden Budget Seeks Minimum Tax On Households Worth $100 Million,POLITICS,"Josh Boak, AP",2022-03-27
GOP Sen. Rick Scott's Lies About His Own Policy Get Called Out On Fox News,POLITICS,Josephine Harvey,2022-03-27
Ex-Maine Gov Candidate Out On Bail After Child Porn Arrest,POLITICS,"Patrick Whittle, AP",2022-03-26
Rep. Madison Cawthorn Tells Audience: 'I Don't Have A Whole Lot Of Wisdom',POLITICS,Mary Papenfuss,2022-03-26
WNBA Legend Lisa Leslie: We Were Told Not To Make 'Big Fuss' Over Brittney Griner,SPORTS,Hilary Hanson,2022-03-26
U.S. Indictment Details Russian Efforts To Hack Worldwide Energy Sector,POLITICS,Nick Visser,2022-03-25
"60 Miles From Ukraine, Biden Sees Refugee Crisis In Poland",POLITICS,"CHRIS MEGERIAN and DARLENE SUPERVILLE, AP",2022-03-25
Key Dem Manchin Says He'll Back Jackson For Supreme Court,POLITICS,"MARY CLARE JALONICK and KEVIN FREKING, AP",2022-03-25
"White House Removes Dr. Oz, Herschel Walker From Presidential Council",POLITICS,Josephine Harvey,2022-03-24
OOPS! Reporters Spot What Sen. Ted Cruz Was Looking At On His Phone During Hearings,POLITICS,Ed Mazza,2022-03-24
Starbucks Workers In Seattle Vote To Form Union,BUSINESS,Dave Jamieson,2022-03-23
Ketanji Brown Jackson Vows To Be Nonpartisan In Supreme Court Hearing,POLITICS,Igor Bobic and Jennifer Bendery,2022-03-21
Liz Cheney Says Jan. 6 Committee Exploring ‘Enhanced Criminal Penalties’ For Trump,POLITICS,Sanjana Karanth,2022-03-20
'No City Anymore': Mariupol Survivors Flee On Train To Safety,POLITICS,"Cara Anna and Renata Brito, AP",2022-03-20
Top Putin Flack Sergey Lavrov Praises Fox News,POLITICS,Lee Moran,2022-03-19
"European Mars Mission Suspended For This Year, Due To War In Ukraine",POLITICS,"John Leicester, AP",2022-03-17
"Irish PM Tests Positive For COVID While Attending Event With Biden, Pelosi",POLITICS,"ZEKE MILLER and COLLEEN LONG, AP",2022-03-17
Pandemic Preparedness Bill Moves Ahead; Funding Still Needed,POLITICS,"Ricardo Alonso-Zaldivar, AP",2022-03-16
Biden To Travel To Europe For NATO Summit On Russia’s War On Ukraine,POLITICS,Sanjana Karanth,2022-03-15
UC Berkeley Can Enroll Thousands More Students As Gov. Signs New Legislation,POLITICS,Sarah Ruiz-Grossman,2022-03-15
"Cops In NYC, DC, Suspect Same Gunman Shot 5 Homeless People",CRIME,Nick Visser,2022-03-14
Joe Manchin Opposes Sarah Bloom Raskin Nomination To Federal Reserve,POLITICS,Igor Bobic,2022-03-14
Idaho Becomes First State To Pass Copycat Texas Abortion Ban,POLITICS,Alanna Vagianos,2022-03-14
Idaho Gov. Candidate Ammon Bundy Busted Protesting Police Seizure Of Malnourished Baby,POLITICS,Mary Papenfuss,2022-03-13
Tom Brady Announces He's Not Retiring After All: 'My Place Is Still On The Field',SPORTS,Josephine Harvey,2022-03-13
"NYC Police Search For Suspect Who Shot 2 Sleeping Homeless Men, One Fatally",CRIME,Mary Papenfuss,2022-03-13
Wisconsin Republicans Want Supreme Court To Block Map That Adds A Black-Majority District,POLITICS,Paul Blumenthal,2022-03-12
Deportation Agents Are Using An App To Monitor Immigrants,POLITICS,"Amy Taxin and Amancai Biraben, AP",2022-03-11
"Senate Gives Final Approval To Ukraine Aid, Huge Budget Bill",POLITICS,"Alan Fram, AP",2022-03-11
"California Can Set Tough Vehicle Emissions Rules Again, Biden Administration Says",POLITICS,Nick Visser,2022-03-10
"House Approves Ban On Russian Oil To U.S., Bolstering Biden",POLITICS,"Lisa Mascaro, AP",2022-03-10
"Texas Flagged 27,000 Mail Ballots For Rejection In Primary",POLITICS,"PAUL J. WEBER and ACACIA CORONADO, AP",2022-03-09
3 More Starbucks Stores Vote To Unionize In Another Victory For Labor Campaign,BUSINESS,Dave Jamieson,2022-03-09
Top Law Enforcement Officials Back Judge Ketanji Brown Jackson's Supreme Court Nomination,POLITICS,"Colleen Long, AP",2022-03-08
Biden Reportedly Set To Ban Russian Oil Imports Over Ukraine War,POLITICS,"Zeke Miller, Mike Balsamo and Josh Boak, AP",2022-03-08
"Shell Says It Will Stop Buying Russian Oil, Natural Gas",BUSINESS,"DANICA KIRKA, AP",2022-03-08
Atlanta Falcons Player Suspended For 2022 Season After Betting On NFL Games,SPORTS,"Charles Odum, AP",2022-03-07
Twitter Reportedly Bans 100 'I Stand With Putin' Accounts For 'Inauthentic Behavior',POLITICS,Mary Papenfuss,2022-03-06
Blinken Vows U.S. Support To Moldova As War Rages In Neighboring Ukraine,POLITICS,"Matthew Lee, AP",2022-03-06
Utah Gov. Spencer Cox Says He Plans To Veto Trans Sports Ban Bill,POLITICS,"Sam Metz and Lindsay Whitehurst, AP",2022-03-05
Kamala Harris To Travel To Poland And Romania Amid Russian Invasion Of Ukraine,POLITICS,Sarah Ruiz-Grossman,2022-03-05
"Zelenskyy Asked For More Lethal Aid, No-Fly Zone In Call With U.S. Congress",POLITICS,Sara Boboltz,2022-03-05
Ukrainians In U.S. To Be Protected From Deportation To War-Torn Homeland,POLITICS,Sarah Ruiz-Grossman,2022-03-04
"U.S. Added 678,000 Jobs In February As Omicron Eases",BUSINESS,"Christopher Rugaber, AP",2022-03-04
Sen. Ben Ray Luján Returns To Congress After Suffering Stroke,POLITICS,Igor Bobic,2022-03-03
Joe Biden: Abortion Rights ‘Under Attack As Never Before’,POLITICS,Alanna Vagianos,2022-03-02
"Russians Face More Sports Sanctions, But Not At Paralympics",SPORTS,"JAMES ELLINGWORTH, AP",2022-03-02
Heated Texas Congressional Primary Still Too Close To Call,POLITICS,Daniel Marans,2022-03-02
MLB Cancels Opening Day As Labor Dispute Continues,SPORTS,"Ronald Blum, AP",2022-03-01
Ukrainian Ambassador Oksana Markarova To Attend Tonight's State Of The Union Speech,POLITICS,Ryan Grenoble,2022-03-01
MLB Pushes Labor-Deal Deadline To Tuesday For March 31 Start,SPORTS,"Ronald Blum, AP",2022-03-01
Biden To Give First State Of The Union Address At Fraught Moment,POLITICS,"ZEKE MILLER and COLLEEN LONG, AP",2022-03-01
'Stand Your Ground' Laws Have Skyrocketed Since Trayvon Martin's Killing,POLITICS,"Curt Anderson and Lindsay Whitehurst, AP",2022-02-26
Republicans At CPAC Would Rather Talk About The Southern Border Than Ukraine,POLITICS,Liz Skalka,2022-02-25
GOP Sen. Jim Inhofe To Retire This Year,POLITICS,Igor Bobic,2022-02-25
Another Starbucks Store Votes To Unionize,BUSINESS,Dave Jamieson,2022-02-25
Russian Military Action In Ukraine Causes Oil Prices To Soar,BUSINESS,"Joe McDonald, AP",2022-02-24
Antony Blinken Says He Believes Russia Will Invade Ukraine Imminently,POLITICS,Nick Visser,2022-02-24
2 Louisiana Deputies Charged In Shooting Death Of Man In Parked Car,CRIME,Sara Boboltz,2022-02-23
Why Texas Progressive Greg Casar Gives Hope To The Embattled Left,POLITICS,Daniel Marans,2022-02-23
Kentucky Elects First Openly LGBTQ State House Member In Special Election,POLITICS,Travis Waldron,2022-02-23
"Allen Weisselberg, Trump Organization Seek To Toss Tax Fraud Case",POLITICS,"Michael R. Sisick, AP",2022-02-23
Man Identified In Portland Mass Shooting Railed Against BLM Protesters: Report,CRIME,Sebastian Murdock,2022-02-22
