headline,category,authors,date
Date With Destiny: Capitol Riot Suspect Nabbed — This Time With Help From Dating App Bumble,POLITICS,Mary Papenfuss,2021-07-24
A ‘Bill Of Rights’ Aims To Keep Child Athletes Safe From Sex Abuse As Olympics Begin,SPORTS,Alanna Vagianos,2021-07-23
GOP Governor Says It's Time To 'Blame The Unvaccinated' For Pandemic Surge,POLITICS,Ed Mazza,2021-07-23
"Marjorie Taylor Greene Wants Chinese Booted For COVID, But Not A Peep About Unvaxxed",POLITICS,Mary Papenfuss,2021-07-23
CDC Director Says Delta Variant Of COVID-19 Among ‘Most Transmissible’ Viruses Known,POLITICS,Nick Visser,2021-07-23
Jill Biden’s 'United' Message To U.S. Olympians: We Are More Than Our Political Parties,POLITICS,Lee Moran,2021-07-23
Biden Hopes For Full FDA Approval Of COVID-19 Vaccines ‘Soon’; Jabs For Kids May Follow,POLITICS,Nick Visser,2021-07-22
"Scabby The Rat, Union Protest Icon, Survives Legal Challenge From Trump Appointee",POLITICS,Dave Jamieson,2021-07-22
More Than 8 Million Kids Could Get Subsidized Child Care Under Democratic Plan,POLITICS,Jonathan Cohn,2021-07-22
"Judge Blasts West Virginia, Says Trans Girl Allowed To Compete On Cross Country Team",POLITICS,Nick Visser,2021-07-22
Conservative Pundit S.E. Cupp Calls Out Republicans For Killing Their Own Voters,POLITICS,Ed Mazza,2021-07-22
Biden's DOJ Is Using A Ridiculous Argument To Defend A Controversial Trump-Era Arms Deal,POLITICS,Akbar Shahid Ahmed,2021-07-21
Trump Told Tell-All Authors He Refused Masks In Order To Look Strong,POLITICS,Lee Moran,2021-07-21
Chris Hayes Nails 'Cowardly' Fox News For Its Biggest Vaccine Hypocrisy Yet,POLITICS,Ed Mazza,2021-07-21
Progressive Group Launches 6-Figure Super PAC To Boost Nina Turner,POLITICS,Daniel Marans,2021-07-20
Kevin McCarthy Trashed On Twitter For 'O.J. Simpson' Approach To Jan. 6 Probe,POLITICS,Ed Mazza,2021-07-20
GOP Lawmaker's Tweet Suggests He's Mad That U.S. Intercepted Fentanyl At The Border,POLITICS,David Moye,2021-07-20
Leading Pediatrics Group Recommends All Kids Wear Masks In School This Fall,POLITICS,Nick Visser,2021-07-20
Kevin McCarthy Chooses 5 House Republicans To Serve On Jan. 6 Committee,POLITICS,Sanjana Karanth,2021-07-20
"Regimes Used Israeli Firm NSO’s Spyware To Target Activists, Journalists: Investigation",POLITICS,Sanjana Karanth,2021-07-19
Biden Continues Tradition Of Taking Credit For A Good Economy — Regardless Of The Cause,POLITICS,S.V. Date,2021-07-19
The Fight For A Key Biden Health Care Policy Is Personal For This House Democrat,POLITICS,Jonathan Cohn,2021-07-19
Surgeon General Portends Return Of Mask Mandates Amid COVID-19 Surges,POLITICS,Nick Visser,2021-07-19
"With Disasters Mounting By The Day, The U.S. May Finally Enact Real Climate Policy",POLITICS,Alexander C. Kaufman,2021-07-18
Coco Gauff Will Miss Olympics After Testing Positive For COVID-19,SPORTS,Sanjana Karanth,2021-07-18
Surgeon General: There's No Value In Locking Up People For Marijuana Use,POLITICS,Nina Golgowski,2021-07-18
Trump Said He Thinks He Could Have Beaten George Washington In An Election,POLITICS,Mary Papenfuss,2021-07-18
GOP Governor’s Vaccination Tour Reveals Depths Of Distrust,POLITICS,"Andrew DeMillo, Associated Press",2021-07-17
How Moderate Democrats Are Sabotaging Their Ideological Allies,POLITICS,Kevin Robillard,2021-07-17
Trump Says Gen. Mark Milley Should Be 'Impeached' Over Coup Fears,POLITICS,Mary Papenfuss,2021-07-17
Democrats Reject Criticism Of Child Tax Credit Accessibility For The Poorest Americans,POLITICS,Tara Golshan,2021-07-16
Biden To Restore Protections For America’s Largest National Forest,POLITICS,Chris D'Angelo,2021-07-15
Judge Nullifies Horse Trainer Bob Baffert’s NY Suspension,SPORTS,David Moye,2021-07-15
"'I’m Here, Mom!': FBI Arrests Man Who Wore Roman Gladiator Costume To Capitol Riot",POLITICS,Ryan J. Reilly,2021-07-15
Unions Gave Money To GOP Lawmakers Who Voted To Overturn The Election,POLITICS,Dave Jamieson,2021-07-14
Democrats Are Throwing Their Whole Agenda Into This $3.5 Trillion Budget Proposal,POLITICS,Igor Bobic and Tara Golshan,2021-07-14
Mitch McConnell ‘Perplexed’ By COVID-19 Vaccine Resistance His Own Party Is Pushing,POLITICS,Igor Bobic,2021-07-13
Donald Trump Calls Jan. 6 Capitol Insurrectionists 'Great People',POLITICS,Igor Bobic,2021-07-12
Novak Djokovic '50-50' On Whether To Play At Tokyo Olympics,SPORTS,"MATTIAS KARÉN, Associated Press",2021-07-12
Fauci Says It's 'Horrifying' To See CPAC Crowd Cheering Anti-Vaccine Remarks,POLITICS,Josephine Harvey,2021-07-11
"GOP Rep. Rips Greene, Boebert For Comparing Biden’s Vaccine Campaign To Nazism",POLITICS,Sanjana Karanth,2021-07-11
Democratic Lawmakers Consider Fleeing Texas To Prevent New Voter Suppression Measures,POLITICS,Mary Papenfuss,2021-07-11
Attempted Republican Troll Of Joe Biden’s Obama Quip Goes Awry,POLITICS,Lee Moran,2021-07-10
People Think There's Something X-Rated About The Shape Of The CPAC Stage,POLITICS,Lee Moran,2021-07-10
Donald Trump Jr. Mocks Texas At CPAC Dallas And Gets The Tumbleweed Treatment,POLITICS,Lee Moran,2021-07-10
"FDA, CDC Say Fully Vaccinated Do Not Need Booster Shots. Yet.",POLITICS,Nick Visser,2021-07-09
"Trump Reportedly Socked Secret Service With $50,000 Bill For Lodging At His Own Properties",POLITICS,Mary Papenfuss,2021-07-09
"ICE To Limit Detention Of Pregnant, Nursing And Postpartum Immigrants",POLITICS,Elise Foley,2021-07-09
Damning Trump Supercut Uses His Own Words To Show Why He’s In Big Legal Trouble,POLITICS,Ed Mazza,2021-07-08
Joe Biden To Make Good On His Afghanistan Promise By Aug. 31,POLITICS,Akbar Shahid Ahmed and S.V. Date,2021-07-08
"Trump Is So Desperate For Social Media He's Suing Facebook, Twitter And YouTube",POLITICS,Ryan Grenoble,2021-07-07
Judge: Air Force Largely At Fault For Texas Church Massacre,CRIME,Nina Golgowski,2021-07-07
Marjorie Taylor Greene’s Holocaust Museum Visit Fails To Stop Her Vaccine Comparisons,POLITICS,Sanjana Karanth,2021-07-07
GOP Lawmaker Sued Over Inciting Insurrection: Trump White House Made Me Do It,POLITICS,Josephine Harvey,2021-07-07
J.D. Vance Wants To Be A GOP Senator So Is Now Super Sorry About Slamming Trump,POLITICS,Lee Moran,2021-07-06
Joe Scarborough Mocks 'Business Genius' Trump For Claiming Not To Know Tax Laws,POLITICS,Josephine Harvey,2021-07-06
Republican Strategist Rails Against Her Own Party: ‘It’s Neofascism!’,POLITICS,Ed Mazza,2021-07-06
Trump Dogged By 'Loser-Palooza' Airplane Message At Florida Rally,POLITICS,Mary Papenfuss,2021-07-05
"Tropical Storm Elsa Prompts Evacuations In Cuba, Florida Declares State Of Emergency",POLITICS,Nick Visser and Lydia O'Connor,2021-07-05
West Virginia GOP Governor Issues Blunt Warning To Unvaccinated,POLITICS,Lee Moran,2021-07-05
July 4 Didn't Have To Be Like This,POLITICS,Jonathan Cohn,2021-07-04
Arizona's Shady Recount Hit With Reported Accusations Of Sexual Harassment,POLITICS,Mary Papenfuss,2021-07-04
"St. Louis Newspaper Bashes GOP, Josh Hawley For 'Contempt' Of Democracy",POLITICS,Mary Papenfuss,2021-07-04
"Ohio Sewer District Takes NYC's Random Twitter Hit On Cleveland, Craps All Over It",POLITICS,Lee Moran,2021-07-03
"After A Year Of Crisis, Reforming The Unemployment System Isn’t On The Agenda",POLITICS,Tara Golshan and Arthur Delaney,2021-07-03
MLB Places Trevor Bauer On Leave Following Sexual Assault Allegations,SPORTS,Dominique Mosbergen,2021-07-02
Rep. Marjorie Taylor Greene Self-Owns With Tweet About Facebook’s Extremist Warning,POLITICS,Lee Moran,2021-07-02
"J.D. Vance, Author Of 'Hillbilly Elegy,' Announces Bid For Ohio Senate Seat",POLITICS,Nick Visser,2021-07-02
Boy Scouts Reach $850 Million Settlement Over Sexual Abuse Claims,POLITICS,Nick Visser,2021-07-02
Ex-Trump Aide's New Social Media Platform Relentlessly Dragged On Twitter,POLITICS,Josephine Harvey,2021-07-02
"Robinhood Fined $70 Million For Misleading Customers, System Outages",POLITICS,"STAN CHOE, AP",2021-07-01
Eric Adams And Kathryn Garcia Lead In Unofficial NYC Mayoral Results,POLITICS,Daniel Marans,2021-07-01
Why New York City’s Board Of Elections Is A Mess,POLITICS,Daniel Marans,2021-07-01
Fox News Fined $1 Million Following Sexual Harassment And Retaliation Investigation,POLITICS,"DAVID BAUDER, AP",2021-06-30
"John Bolton Almost Gave His Donald Trump Memoir A NSFW Title, But Was Talked Out Of It",POLITICS,Lee Moran,2021-06-30
William Barr's Own Words About Trump Come Back To Haunt Him In Damning Supercut,POLITICS,Ed Mazza,2021-06-29
Tom Brady’s Personalized Golf Balls Are The G.O.A.T.,SPORTS,Lee Moran,2021-06-29
'Mace Her!': Woman Accused Of Filming Capitol Attack On NYT Photographer Is Arrested,POLITICS,Josephine Harvey,2021-06-29
GOP's Long Race To 2024 Begins,POLITICS,"Jill Colvin and Thomas Beaumont, AP",2021-06-29
Tucker Carlson Claims NSA Is Spying On Him To Cancel His Fox News Show,POLITICS,Ron Dicker,2021-06-29
Democrats Introduce Bill To Invest In Public Safety Alternatives To Police,POLITICS,Sarah Ruiz-Grossman,2021-06-28
"Pacific Northwest Heat Records Shattered As Seattle Hits 104F, Portland 112F",POLITICS,Nick Visser,2021-06-28
Serena Williams Says She Won't Play At Tokyo Olympics,SPORTS,"Howard Fendrich, AP",2021-06-27
Blinken Meets With New Israeli Counterpart As Both Governments Try To Reset Relations,POLITICS,"Laurie Kellman, Matthew Lee and Ellen Knickmeyer, AP",2021-06-27
AOC Warns Biden's Election Win Likely Wouldn't Have Been Certified With A GOP House,POLITICS,Mary Papenfuss,2021-06-26
Ex-Ethics Chief Rips Biden Over Jobs For Aides' Relatives After 4 Years Of Trump Nepotism,POLITICS,Mary Papenfuss,2021-06-26
Top Ohio Republicans Are Ditching Trump's 'Pity Party' Rally In The State,POLITICS,Mary Papenfuss,2021-06-25
White House Deputy Press Secretary Shares Thoughtful Coming-Out Message,POLITICS,Sara Boboltz,2021-06-25
"How India Walton, A Democratic Socialist, Defeated Buffalo’s Mayor",POLITICS,Daniel Marans,2021-06-25
Biden’s Green Allies Launch Major Campaign As Bipartisan Deal Shrinks From Climate,POLITICS,Alexander C. Kaufman,2021-06-25
Joe Biden Endorses Deal On Infrastructure With Bipartisan Group Of Senators,POLITICS,Igor Bobic and Arthur Delaney,2021-06-24
Tammy Duckworth Calls On Congress To Better Protect Immigrant Veterans,POLITICS,Nick Visser,2021-06-24
Biden Hints At Renewed Fight Against State-Led Voter Restrictions,POLITICS,Ryan Grenoble,2021-06-24
Joe Biden Launches Blitz Against Illegal Guns In Response To Spike In Shootings,POLITICS,Kevin Robillard and Sanjana Karanth,2021-06-23
Democrats Press Administration To Continue Student Loan Payment Pause,POLITICS,Kevin Robillard,2021-06-23
Kamala Harris To Visit U.S.-Mexico Border Amid Republican Backlash,POLITICS,Lydia O'Connor,2021-06-23
Polls Close And Waiting Begins In NYC Mayoral Primary,POLITICS,"Karen Matthews, AP",2021-06-23
Biden Slams Republicans For Blocking Debate On Voting Rights Bill,POLITICS,Lydia O'Connor,2021-06-23
Nancy Pelosi To Decide Soon On House Select Committee To Probe Capitol Riot,POLITICS,Nick Visser,2021-06-22
What’s Next In The Filibuster Fight After Republicans Block Voting Rights Bill,POLITICS,Paul Blumenthal,2021-06-22
California Eyes Paying Off Past-Due Rent Accrued During Pandemic,POLITICS,Nina Golgowski,2021-06-22
Can America Finally Do Something On Drug Prices? This Democratic Senator Thinks So.,POLITICS,Jonathan Cohn,2021-06-22
"Republicans Block Debate On Voting Rights Bill, Setting Up Summer Filibuster Fight",POLITICS,Paul Blumenthal and Igor Bobic,2021-06-22
"Tokyo Olympics To Allow Limit Of 10,000 Local Fans In Venues",SPORTS,"Stephen Wade, AP",2021-06-21
Former FDA Chief Says COVID-19 Variant May Cause Surge In States With Low Vaccination,POLITICS,Nick Visser,2021-06-21
Some GOP States Give Police More Power Amid Calls For Defunding And Accountability,POLITICS,"FARNOUSH AMIRI, AP",2021-06-20
Senator Ron Johnson Loudly Booed At Milwaukee Juneteenth Celebration,POLITICS,Mary Papenfuss,2021-06-20
Infectious Disease Expert Warns 'We’re Not Done With This Virus At All',POLITICS,Lee Moran,2021-06-19
Mike Pence's 'Cancel Culture' Rallying Cry Is Too Much For Folks On Twitter,POLITICS,Lee Moran,2021-06-19
Judge Blocks CDC From Enforcing Cruise Ship Coronavirus Rules,POLITICS,Sara Boboltz,2021-06-19
Twitter Critics Go To War Over Dead Capitol Rioter Ashli Babbitt,POLITICS,Mary Papenfuss,2021-06-19
Congressman Reveals True Terror Of Republicans Now Downplaying Capitol Riot,POLITICS,Lee Moran,2021-06-18
Joe Biden Announces 300 Million Coronavirus Vaccines Have Been Administered,POLITICS,Sebastian Murdock,2021-06-18
"LGBTQ Groups, Allies See Trouble In Ruling Upholding Discrimination In Philly",POLITICS,Ja'han Jones,2021-06-18
"Biden Administration Unveils $3.2 Billion Hunt For Pill To Treat COVID-19, Other Viruses",POLITICS,Nick Visser,2021-06-18
Wimbledon Reaches Out To Naomi Osaka Over Media Operations,SPORTS,Ron Dicker,2021-06-17
Federal Workers Will Get Friday Off To Observe Juneteenth,POLITICS,Jennifer Bendery,2021-06-17
"Trans Students Protected Under Title IX, Biden Administration Says",POLITICS,Nick Visser,2021-06-17
'The View' Hosts Shred Marjorie Taylor Greene: Apology 'As Empty As Her Head',POLITICS,Josephine Harvey,2021-06-16
House Passes Bill Awarding Gold Medal To All Officers Who Responded To Capitol Riot,POLITICS,Dominique Mosbergen,2021-06-16
"House Passes Juneteenth Holiday Bill, Sending It To Joe Biden’s Desk",POLITICS,Arthur Delaney and Igor Bobic,2021-06-16
Ex-Bush Speechwriter Dismantles 'The Dreams Of Conservatives' In Scathing Essay,POLITICS,Lee Moran,2021-06-15
MLB Pitchers Could Face 10-Game Bans For Altering Balls: Commissioner,SPORTS,"Ronald Blum, AP",2021-06-15
Biden Administration Pushes Plan To Combat Domestic Terror,POLITICS,"Michael Balsamo, AP",2021-06-15
"House Judiciary Committee Will Probe Trump Subpoenas Against Media, Democrats",POLITICS,Nick Visser,2021-06-15
Justice Department Secretly Subpoenaed Don McGahn’s Records: AP Source,POLITICS,"MICHAEL BALSAMO and ERIC TUCKER, AP",2021-06-14
U.S. Intel Warns Of More Violence From QAnon Followers,POLITICS,"Michael Kunzelman and Nomaan Merchant, AP",2021-06-14
Reality Winner Released Early From Prison For Good Behavior,POLITICS,Ryan Grenoble,2021-06-14
Interior Secretary Recommends Biden Restore National Monuments Trump Trashed,POLITICS,Chris D'Angelo,2021-06-14
Pelosi Says Trump DOJ’s Secret Data Seizures Go ‘Beyond Richard Nixon’,POLITICS,Sanjana Karanth,2021-06-13
Ex-Prosecutor Pulls No Punches With Donald Trump: 'Unabated Crime Wave As President',POLITICS,Lee Moran,2021-06-12
'Action Figures' Photo Of Joe Biden With G-7 Leaders Becomes A Meme,POLITICS,Lee Moran,2021-06-12
Biden Shutters Trump-Era Office For Crimes Allegedly Committed By Immigrants,POLITICS,"Elliot Spagat, AP",2021-06-12
Watergate Figure John Dean: New Donald Trump Scandal Is ‘Nixon On Stilts And Steroids’,POLITICS,Lee Moran,2021-06-12
Republicans Push To Export Absurd Arizona-Style Election Audits To Other States,POLITICS,Travis Waldron,2021-06-11
"Senate Leaders Demand Bill Barr, Jeff Sessions Testify About 'Shocking' Trump Data Seizure",POLITICS,"MARY CLARE JALONICK and MICHAEL BALSAMO, AP",2021-06-11
Unemployment Benefit Cuts Start This Weekend,POLITICS,Arthur Delaney,2021-06-10
Ex-GOP Rep. Tells Republicans: Ditch ‘Patron Saint Of Sore Losers' Donald Trump,POLITICS,Lee Moran,2021-06-10
"Biden White House Drops Trump Orders Trying To Ban TikTok, WeChat",POLITICS,"Matt O'Brien, Eric Tucker and Tali Arbel, AP",2021-06-09
Coco Gauff's French Open Loss Is The Wrong Kind Of Smashing Success,SPORTS,Ron Dicker,2021-06-09
Democratic Senate Hopeful In Missouri Mocks Opponent Who Pointed Gun At BLM Protesters,POLITICS,Sarah Ruiz-Grossman,2021-06-09
Senate Report Details Sweeping Failures Around Jan. 6 U.S. Capitol Attack,POLITICS,"MARY CLARE JALONICK, AP",2021-06-08
Washington State Approves 'Joints For Jabs' COVID-19 Vaccine Promotion,POLITICS,Sarah Ruiz-Grossman,2021-06-08
Senate Passes Legislation To Support Victims Of Mysterious ‘Havana Syndrome’,POLITICS,Nick Visser,2021-06-08
Schumer: Senate Report 'Strengthened Argument' For Jan. 6 Commission,POLITICS,Sara Boboltz,2021-06-08
'A Lot Of Anxiety' For Democrats As Biden Agenda Stalls,POLITICS,"Lisa Mascaro, AP Wire",2021-06-08
David Attenborough Says Climate Change Is A ‘Crime’ Humanity Has Inflicted On The Planet,POLITICS,Nick Visser,2021-06-07
Naomi Osaka Drops Out Of 2nd Tournament Amid Break For Mental Health,SPORTS,Hayley Miller,2021-06-07
"Manchin Says He'll Vote Against Voting Rights Bill, Dooming Dems' Election Overhaul Efforts",POLITICS,Hayley Miller,2021-06-06
Major Kyrsten Sinema Supporter Says Abolish Filibuster Or Get Out Of The Senate,POLITICS,Amanda Terkel,2021-06-04
Volleyballer Makes Racist Gesture About Thai Opponent During Televised Match,SPORTS,Josephine Harvey,2021-06-04
Kamala Harris Will Go Around Congress To Build Support For Voting Rights,POLITICS,Kevin Robillard and Paul Blumenthal,2021-06-03
Ted Cruz Tries A Monty Python Crack And Twitter Users Run Away,POLITICS,Lee Moran,2021-06-03
High School Valedictorian Uses Speech To Blast Texas' New Abortion Ban,POLITICS,Lydia O'Connor,2021-06-02
Venus Williams 'Drops The Mic' With Fiercely Honest Take On Naomi Osaka Situation,SPORTS,Josephine Harvey,2021-06-02
Conservative Columnist Warns Of GOP Plot To Steal 2024 Election,POLITICS,Lee Moran,2021-06-02
Biden Administration To Suspend Trump-Era Oil Leases In Arctic Refuge,POLITICS,Chris D'Angelo,2021-06-01
Marjorie Taylor Greene Tweets About Racism And It's Too Much For Twitter,POLITICS,Ron Dicker,2021-06-01
Twins Outfielder Delivers One Of The Greatest Sports Bloopers Of All Time,SPORTS,Ed Mazza,2021-06-01
Texas Democrats Block Harsh Voting Bill By Walking Out En Masse,POLITICS,Nick Visser,2021-05-31
Juan Williams: 'Extremism Among Republicans Is Paralyzing Congress',POLITICS,Ron Dicker,2021-05-31
"Trump CFO 'Perjured Himself,' Felt 'Enabled' With Boss In White House: Ex-Daughter-In-Law",POLITICS,Mary Papenfuss,2021-05-31
'A Defining Historical Moment': Raphael Warnock On The GOP's Blockade Of Jan. 6 Commission,POLITICS,Ryan J. Reilly,2021-05-30
"Naomi Osaka Fined $15,000 For Refusing To Speak With Press At French Open",SPORTS,Ja'han Jones,2021-05-30
Experts Believe Prosecutors Are Mulling 'Little RICO' Mob Law Against Trump Org: Report,POLITICS,Mary Papenfuss,2021-05-30
Conservative Pundit Hits GOP With A Scathing Question,POLITICS,Lee Moran,2021-05-29
Rep. Gerry Connolly Calls On Biden To Create Jan. 6 Commission After 'Cowardly' GOP Vote,POLITICS,Mary Papenfuss,2021-05-29
GOP Accused Of Betraying America In Progressive PAC's Stinging New Ad,POLITICS,Lee Moran,2021-05-29
CEO Pay Rises To $12.7M Even As Pandemic Ravages Economy,POLITICS,"Stan Choe, Associated Press",2021-05-28
Officer Brian Sicknick's Grieving Mom Hits The Hill To Plead For Jan. 6 Commission,POLITICS,Mary Papenfuss,2021-05-28
Twitter Erupts After Rep. Marjorie Taylor Greene Breaks Out ‘Mexican Accent’,POLITICS,Ed Mazza,2021-05-28
Cubs Star's Ordinary Ground Ball Turns Into The Adventure Of A Lifetime,SPORTS,Ed Mazza,2021-05-28
New York City’s Rising Left Is Losing The Mayor’s Race,POLITICS,Daniel Marans,2021-05-27
Disability Rights Groups Join Lawsuit Over Georgia Voter Suppression Law,POLITICS,Sanjana Karanth,2021-05-26
Judge Approves Prosecution Deal For Jeffrey Epstein Prison Guards,CRIME,"LARRY NEUMEISTER, AP",2021-05-26
Woman Protests COVID-19 Vaccine By Speeding Car Through Vaccination Site,CRIME,David Moye,2021-05-26
He Called FBI Agents Nazis. The Feds Just Arrested Him For Storming The Capitol.,POLITICS,Hayley Miller and Ryan J. Reilly,2021-05-26
Growing Mystery Of Suspected Energy Attacks Draws U.S. Concern,POLITICS,"Nomaan Merchant, Robert Burns and Eric Tucker, AP",2021-05-23
Donald Trump's Much-Touted Blog Pretty Much A Flop As Interest Fades: Report,POLITICS,Mary Papenfuss,2021-05-23
Ivanka Trump In A Fog In Deposition About Role Of Investigated Top Trump Executive,POLITICS,Mary Papenfuss,2021-05-23
Biden To Host Family Of George Floyd On 1-Year Anniversary Of His Death,POLITICS,Sara Boboltz,2021-05-22
Palestinians In The U.S. Fear For Their Families In Gaza: ‘Are You Still Alive?’,POLITICS,Rowaida Abdelaziz,2021-05-22
Ex-Bush Aide Gives Chilling Reality Check About Continued GOP Capitulation To Trump,POLITICS,Lee Moran,2021-05-22
Matt Gaetz's Ex-Girlfriend Reportedly Agrees To Cooperate With Sex Trafficking Investigators,POLITICS,Mary Papenfuss,2021-05-22
CNN Drops Rick Santorum After Racist Comments About Native Americans,POLITICS,Jennifer Bendery,2021-05-22
Biden Says He Won't Allow His DOJ To Seize Reporters' Records,POLITICS,Lydia O'Connor,2021-05-21
White House Offers GOP $1.7 Trillion Infrastructure Plan,POLITICS,"Lisa Mascaro and Jonathan Lemire, AP",2021-05-21
Biden Says There Is 'No Shift' In U.S. Commitment To Israel's Security,POLITICS,Sarah Ruiz-Grossman,2021-05-21
Ex-Secret Service Agent Details 'Shockingly' Racist Abuse Endured By Michelle Obama,POLITICS,Lee Moran,2021-05-21
Michael Cohen Reveals When And How Trump Will Flip On His Own Family To Avoid Jail,POLITICS,Ed Mazza,2021-05-20
Kamala Harris: 'Asian Americans Have The Right To Be Recognized As Americans',POLITICS,Sarah Ruiz-Grossman,2021-05-19
"Biden, In Netanyahu Call, Urges 'Significant De-escalation'",POLITICS,"Ellen Knickmeyer, AP",2021-05-19
Laura Ingraham: Left Used  COVID Lockdowns To Groom Public For Climate Change Lockdowns,POLITICS,Ron Dicker,2021-05-19
Gun-Waving Attorney Mark McCloskey Running For Missouri Senate Seat,POLITICS,Nick Visser,2021-05-19
"Oversight, Homeland Security Committees 'Extremely Concerned' After Pipeline Attack",POLITICS,Sanjana Karanth,2021-05-18
Nancy Pelosi Calls For Cease-Fire Between Israel And Hamas,POLITICS,Sarah Ruiz-Grossman,2021-05-18
Congress Sends Anti-Asian Hate Crimes Bill To Biden's Desk,POLITICS,Sara Boboltz,2021-05-18
Progressives Ask Biden Not To Name Pharma Allies To Top Patent Posts,POLITICS,Daniel Marans,2021-05-18
"U.S. Commits To Admitting About 250 Asylum-Seekers Per Day, Attorney Says",POLITICS,"Elliot Spagat, AP",2021-05-18
New York Gov. Andrew Cuomo Set To Earn $5 Million From COVID-19 Book,POLITICS,Nick Visser,2021-05-18
GOP Voting Restrictions Will Make It Harder For People With Disabilities To Cast Ballots,POLITICS,Travis Waldron,2021-05-17
South Carolina Law Forces Death Row Inmates To Choose Firing Squad Or Electric Chair,POLITICS,"JEFFREY COLLINS, AP",2021-05-17
"As Biden Stays Mum, Senators Make Bipartisan Call For Cease-Fire In Gaza",POLITICS,Sanjana Karanth,2021-05-17
Joe Biden Expresses Support For Cease-Fire In Call With Israeli Prime Minister Netanyahu,POLITICS,Ja'han Jones,2021-05-17
Minneapolis Suburb Approves Changes To Policing After Daunte Wright’s Death,POLITICS,Sanjana Karanth,2021-05-17
Fox News' Juan Williams: GOP's Loyalty To Trump Defies Political Reality,POLITICS,Ron Dicker,2021-05-17
GOP Arizona County Chair Slams Twisted Republican Recount As 'Dangerous',POLITICS,Mary Papenfuss,2021-05-16
"America's Deadly Domestic Extremism Worst In 24 Years, Reveals New FBI Report",POLITICS,Mary Papenfuss,2021-05-16
Don Lemon Teases 'End Of An Era' At CNN But It's 'Not What You Think',POLITICS,Lee Moran,2021-05-15
Rep. Kevin McCarthy Slights Joe Biden For Needing 5 Hours Of Sleep A Night,POLITICS,Mary Papenfuss,2021-05-15
Colonial Pipeline Reportedly Paid $5 Million Ransom After Hack,POLITICS,Nick Visser,2021-05-14
Democrats Are Slowly Getting More Critical Of Israel,POLITICS,Daniel Marans,2021-05-14
California Attorney General To Review Police Killing Of Sean Monterrosa,POLITICS,Sarah Ruiz-Grossman,2021-05-14
Restaurants Brace For Federal Aid To Run Dry Before They Get Help,POLITICS,Tara Golshan,2021-05-14
Nevada Democrats Squander Opportunity To End Death Penalty,POLITICS,Jessica Schulberg,2021-05-13
Black Candidates In Crowded Races Test Democrats’ Racial Equality Push,POLITICS,Kevin Robillard,2021-05-13
Teachers Union President Is 'All In' On Full Fall School Reopening,POLITICS,"Collin Binkley, AP",2021-05-13
Joe Biden Asks Americans To Stop Panic-Buying Gas And Making Supply Issue Worse,POLITICS,Ryan Grenoble,2021-05-13
'I Was There': Mitt Romney Sets Record Straight On Jan. 6 Insurrection,POLITICS,Igor Bobic,2021-05-13
Arizona Gov. Signs Bill To Purge Early Voters Who Don't Vote By Mail In 2 Election Cycles,POLITICS,Sarah Ruiz-Grossman,2021-05-12
The COVID-19 Vaccine Patent Waiver Fight Is Far From Over,POLITICS,Daniel Marans,2021-05-12
Pipe Bomb Suspect Remains A Mystery 4 Months After Capitol Riot,POLITICS,Sebastian Murdock,2021-05-12
How New York Could Build Publicly Owned Electricity Without Taking Over Dirty Plants,POLITICS,Alexander C. Kaufman,2021-05-12
Texas GOP Passes Bill To Stop Teachers From Talking About Racism,POLITICS,Jennifer Bendery,2021-05-12
Migrant Children Held In Mass Shelters With Little Oversight,POLITICS,"Garance Burke, Juliet Linderman and Martha Mendoza, AP",2021-05-11
"White House Partners With Uber, Lyft For Free Rides To Vaccine Sites",POLITICS,Lydia O'Connor,2021-05-11
Pentagon Chief During Jan. 6 Riot Defends Military Response,POLITICS,"Eric Tucker and Michael Balsamo, AP",2021-05-11
More Than 1 Million Have Signed Up For Coverage At HealthCare.Gov This Year,POLITICS,Jonathan Cohn,2021-05-11
California Plans To Invest $12 Billion To Fight Homelessness Crisis,POLITICS,Sarah Ruiz-Grossman,2021-05-11
Kevin McCarthy Says 'Big Tent Party' Is Ready To Purge Liz Cheney,POLITICS,Elise Foley,2021-05-10
Mitch McConnell Poised For Starring Role In Voting Bill Fight,POLITICS,"Lisa Mascaro, Brian Slodysko and Christina A. Cassidy, AP",2021-05-10
GOP Gov. Larry Hogan Slams His Party's Division Over 'Fealty To The Dear Leader',POLITICS,Josephine Harvey,2021-05-10
Watchdog Says Capitol Police Deficient At Monitoring Threats,POLITICS,"Mary Clare Jalonick, AP",2021-05-10
FAA Pursuing Civil Penalties Against Misbehaving Airline Passengers,POLITICS,"The Associated Press, AP",2021-05-10
